{
  "$schema": "https://json-schema.org/draft/2020-12/schema",
  "title": "AutoFly UE5 scene file (spec 6.1)",
  "type": "object",
  "additionalProperties": false,
  "required": ["id", "split", "seed", "bounds", "ground", "obstacle_groups", "start_band", "target_band", "altitude_band", "instruction_obstacle"],
  "properties": {
    "id": { "type": "string", "pattern": "^s[0-9]{2}[rd]?$" },
    "level": { "type": "string", "pattern": "^s[0-9]{2}r?$" },
    "split": { "enum": ["train", "test_seen", "test_unseen"] },
    "seed": { "type": "integer", "minimum": 0 },
    "bounds": {
      "type": "object",
      "additionalProperties": false,
      "required": ["x_min", "x_max", "y_min", "y_max"],
      "properties": {
        "x_min": { "type": "number" }, "x_max": { "type": "number" },
        "y_min": { "type": "number" }, "y_max": { "type": "number" }
      }
    },
    "ground": { "type": "string", "minLength": 1 },
    "obstacle_groups": { "type": "array", "minItems": 1, "items": { "$ref": "#/$defs/group" } },
    "start_band": { "$ref": "#/$defs/range" },
    "target_band": { "$ref": "#/$defs/range" },
    "altitude_band": { "$ref": "#/$defs/range" },
    "instruction_obstacle": { "type": "string", "minLength": 1 },
    "dynamic": { "$ref": "#/$defs/dynamic" },
    "spawn_clearance_m": {
      "type": "number", "minimum": 1.4,
      "description": "2026-10-08: the episode sampler's clearance (m) from every obstacle circle for starts, targets and distractors, when a scene needs a wider training margin than the default 1.4 m allows (expert/episode.py scene_spawn_clearance_m). The sampler only: the layout is still accepted at 1.4 m, the reachability inflation, so the floor is 1.4 m (a smaller value would start episodes in space no layout check cleared). Not a property of the level: it leaves the layout and the built level unchanged, but a scene reusing a level must match it."
    },
    "exposure_bias_ev": {
      "type": "number", "minimum": -16, "maximum": -6,
      "description": "2026-10-08 (plan 5 C7): the level's manual exposure bias in EV; the image multiplier is exactly 2**bias_ev (docs/gates/exposure_calibration.json). Omitted: -11 EV, calibrated on s01's grid floor and measured within 40 levels of its mean brightness on s02, s07 and s09. A bright ground (snow) needs its own, found the same way. The range spans every value ever measured plus a margin; outside it is a typo, not a calibration. A property of the level: a scene reusing a level must match it."
    },
    "reward": {
      "type": "object", "additionalProperties": false, "minProperties": 1,
      "properties": {
        "k_p": { "type": "number", "minimum": 0 }, "k_h": { "type": "number", "minimum": 0 },
        "k_t": { "type": "number", "minimum": 0 }, "r_success": { "type": "number", "minimum": 0 },
        "r_collision": { "type": "number", "minimum": 0 }, "r_bounds": { "type": "number", "minimum": 0 }
      }
    }
  },
  "$defs": {
    "range": { "type": "array", "items": { "type": "number", "minimum": 0 }, "minItems": 2, "maxItems": 2 },
    "int_range": { "type": "array", "items": { "type": "integer", "minimum": 1 }, "minItems": 2, "maxItems": 2 },
    "int_range0": { "type": "array", "items": { "type": "integer", "minimum": 0 }, "minItems": 2, "maxItems": 2 },
    "positive_range": { "type": "array", "items": { "type": "number", "exclusiveMinimum": 0 }, "minItems": 2, "maxItems": 2 },
    "dynamic": {
      "type": "object", "additionalProperties": false,
      "required": ["movers", "route_kinds", "speed_m_s", "pingpong_half_length_m", "orbit_radius_m", "min_gap_m", "contact_m",
                   "yield_margin_m", "start_keepout_m", "target_keepout_m", "max_path_ratio"],
      "properties": {
        "movers": {
          "type": "object", "additionalProperties": false, "required": ["source", "count", "path_movers", "path_corridor_m"],
          "properties": { "source": { "const": "layout" }, "count": { "$ref": "#/$defs/int_range" },
                          "path_movers": { "$ref": "#/$defs/int_range0" }, "path_corridor_m": { "type": "number", "exclusiveMinimum": 0 } }
        },
        "route_kinds": { "type": "array", "minItems": 1, "uniqueItems": true, "items": { "enum": ["pingpong", "orbit"] } },
        "speed_m_s": { "$ref": "#/$defs/positive_range" },
        "pingpong_half_length_m": { "$ref": "#/$defs/positive_range" },
        "orbit_radius_m": { "$ref": "#/$defs/positive_range" },
        "min_gap_m": { "type": "number", "minimum": 0 },
        "contact_m": { "type": "number", "exclusiveMinimum": 0 },
        "yield_margin_m": { "type": "number", "minimum": 0 },
        "start_keepout_m": { "type": "number", "minimum": 0 },
        "target_keepout_m": { "type": "number", "minimum": 0 },
        "max_path_ratio": { "type": "number", "minimum": 1 }
      }
    },
    "group": {
      "type": "object",
      "additionalProperties": false,
      "required": ["asset", "count", "scale_range", "palette", "placement"],
      "properties": {
        "asset": { "type": "string", "minLength": 1 },
        "count": { "type": "integer", "minimum": 1 },
        "scale_range": {
          "type": "object",
          "additionalProperties": false,
          "required": ["xy", "z"],
          "properties": { "xy": { "$ref": "#/$defs/range" }, "z": { "$ref": "#/$defs/range" } }
        },
        "palette": { "type": "array", "minItems": 1, "items": { "type": "string", "minLength": 1 } },
        "placement": {
          "oneOf": [
            { "$ref": "#/$defs/jittered_grid" },
            { "$ref": "#/$defs/poisson" },
            { "$ref": "#/$defs/clusters" },
            { "$ref": "#/$defs/stacks" }
          ]
        }
      }
    },
    "jittered_grid": {
      "type": "object", "additionalProperties": false, "required": ["type", "margin_m", "jitter_m"],
      "properties": { "type": { "const": "jittered_grid" }, "margin_m": { "type": "number", "minimum": 0 }, "jitter_m": { "type": "number", "minimum": 0 } }
    },
    "poisson": {
      "type": "object", "additionalProperties": false, "required": ["type", "margin_m", "min_distance_m"],
      "properties": { "type": { "const": "poisson" }, "margin_m": { "type": "number", "minimum": 0 }, "min_distance_m": { "type": "number", "exclusiveMinimum": 0 } }
    },
    "clusters": {
      "type": "object", "additionalProperties": false, "required": ["type", "margin_m", "cluster_count", "per_cluster", "radius_m"],
      "properties": { "type": { "const": "clusters" }, "margin_m": { "type": "number", "minimum": 0 }, "cluster_count": { "type": "integer", "minimum": 1 },
                      "per_cluster": { "$ref": "#/$defs/int_range" }, "radius_m": { "type": "number", "exclusiveMinimum": 0 } }
    },
    "stacks": {
      "type": "object", "additionalProperties": false, "required": ["type", "margin_m", "stack_count", "height_range"],
      "properties": { "type": { "const": "stacks" }, "margin_m": { "type": "number", "minimum": 0 }, "stack_count": { "type": "integer", "minimum": 1 },
                      "height_range": { "$ref": "#/$defs/int_range" } }
    }
  }
}
