{
  "id": "s01d",
  "split": "train",
  "seed": 1001,
  "bounds": { "x_min": -35.0, "x_max": 35.0, "y_min": -35.0, "y_max": 35.0 },
  "ground": "grid",
  "obstacle_groups": [
    {
      "asset": "cylinder",
      "count": 80,
      "scale_range": { "xy": [0.8, 1.2], "z": [8.0, 12.0] },
      "palette": ["white"],
      "placement": { "type": "jittered_grid", "margin_m": 8.0, "jitter_m": 1.0 }
    }
  ],
  "start_band": [2.0, 6.0],
  "target_band": [0.0, 3.0],
  "altitude_band": [1.0, 3.0],
  "instruction_obstacle": "white pillars",
  "level": "s01",
  "dynamic": {
    "movers": { "source": "layout", "count": [8, 12], "path_movers": [2, 4], "path_corridor_m": 4.0 },
    "route_kinds": ["pingpong", "orbit"],
    "speed_m_s": [0.4, 1.2],
    "pingpong_half_length_m": [1.0, 2.5],
    "orbit_radius_m": [1.0, 2.0],
    "min_gap_m": 1.0,
    "contact_m": 1.0,
    "yield_margin_m": 1.5,
    "start_keepout_m": 6.0,
    "target_keepout_m": 4.0,
    "max_path_ratio": 1.2
  }
}
