{
  "id": "s04",
  "split": "train",
  "seed": 1004,
  "bounds": {
    "x_min": -35.0,
    "x_max": 35.0,
    "y_min": -35.0,
    "y_max": 35.0
  },
  "ground": "gravel",
  "obstacle_groups": [
    {
      "asset": "boulder_01",
      "count": 6,
      "scale_range": {
        "xy": [
          1.8,
          2.2
        ],
        "z": [
          1.8,
          2.2
        ]
      },
      "palette": [
        "mesh"
      ],
      "placement": {
        "type": "poisson",
        "margin_m": 8.0,
        "min_distance_m": 10.0
      }
    },
    {
      "asset": "namaqualand_boulder_02",
      "count": 5,
      "scale_range": {
        "xy": [
          1.8,
          2.2
        ],
        "z": [
          1.8,
          2.2
        ]
      },
      "palette": [
        "mesh"
      ],
      "placement": {
        "type": "poisson",
        "margin_m": 8.0,
        "min_distance_m": 10.0
      }
    },
    {
      "asset": "namaqualand_boulder_06",
      "count": 8,
      "scale_range": {
        "xy": [
          2.4,
          3.0
        ],
        "z": [
          2.4,
          3.0
        ]
      },
      "palette": [
        "red",
        "blue",
        "yellow",
        "green",
        "white"
      ],
      "placement": {
        "type": "poisson",
        "margin_m": 8.0,
        "min_distance_m": 7.0
      }
    },
    {
      "asset": "namaqualand_boulder_05",
      "count": 8,
      "scale_range": {
        "xy": [
          2.6,
          3.2
        ],
        "z": [
          2.6,
          3.2
        ]
      },
      "palette": [
        "red",
        "blue",
        "yellow",
        "green",
        "white"
      ],
      "placement": {
        "type": "poisson",
        "margin_m": 8.0,
        "min_distance_m": 7.0
      }
    },
    {
      "asset": "boulder_01",
      "count": 6,
      "scale_range": {
        "xy": [
          1.4,
          1.8
        ],
        "z": [
          1.4,
          1.8
        ]
      },
      "palette": [
        "red",
        "blue",
        "yellow",
        "green",
        "white"
      ],
      "placement": {
        "type": "poisson",
        "margin_m": 8.0,
        "min_distance_m": 8.0
      }
    }
  ],
  "start_band": [
    2.0,
    6.0
  ],
  "target_band": [
    0.0,
    3.0
  ],
  "altitude_band": [
    1.0,
    3.0
  ],
  "instruction_obstacle": "stone field"
}
