{
  "id": "s07",
  "split": "train",
  "seed": 1007,
  "bounds": {
    "x_min": -35.0,
    "x_max": 35.0,
    "y_min": -35.0,
    "y_max": 35.0
  },
  "ground": "sand",
  "obstacle_groups": [
    {
      "asset": "crate",
      "count": 60,
      "scale_range": {
        "xy": [
          1.0,
          1.6
        ],
        "z": [
          0.9,
          1.2
        ]
      },
      "palette": [
        "wood"
      ],
      "placement": {
        "type": "stacks",
        "margin_m": 8.0,
        "stack_count": 18,
        "height_range": [
          2,
          5
        ]
      }
    }
  ],
  "start_band": [
    2.0,
    6.0
  ],
  "target_band": [
    0.0,
    3.0
  ],
  "altitude_band": [
    1.0,
    3.0
  ],
  "instruction_obstacle": "stacked boxes"
}
