{
  "id": "s01",
  "split": "train",
  "seed": 1001,
  "bounds": { "x_min": -35.0, "x_max": 35.0, "y_min": -35.0, "y_max": 35.0 },
  "ground": "grid",
  "obstacle_groups": [
    {
      "asset": "cylinder",
      "count": 80,
      "scale_range": { "xy": [0.8, 1.2], "z": [8.0, 12.0] },
      "palette": ["white"],
      "placement": { "type": "jittered_grid", "margin_m": 8.0, "jitter_m": 1.0 }
    }
  ],
  "start_band": [2.0, 6.0],
  "target_band": [0.0, 3.0],
  "altitude_band": [1.0, 3.0],
  "instruction_obstacle": "white pillars"
}
