{
  "id": "s05r",
  "split": "test_seen",
  "seed": 2005,
  "bounds": {
    "x_min": -35.0,
    "x_max": 35.0,
    "y_min": -35.0,
    "y_max": 35.0
  },
  "ground": "snow",
  "obstacle_groups": [
    {
      "asset": "namaqualand_boulder_04",
      "count": 6,
      "scale_range": {
        "xy": [
          1.4,
          1.8
        ],
        "z": [
          2.8,
          3.6
        ]
      },
      "palette": [
        "mesh"
      ],
      "placement": {
        "type": "poisson",
        "margin_m": 8.0,
        "min_distance_m": 14.0
      }
    },
    {
      "asset": "namaqualand_boulder_03",
      "count": 6,
      "scale_range": {
        "xy": [
          1.3,
          1.7
        ],
        "z": [
          2.6,
          3.4
        ]
      },
      "palette": [
        "mesh"
      ],
      "placement": {
        "type": "poisson",
        "margin_m": 8.0,
        "min_distance_m": 12.0
      }
    },
    {
      "asset": "boulder_01",
      "count": 7,
      "scale_range": {
        "xy": [
          2.0,
          2.6
        ],
        "z": [
          2.0,
          2.6
        ]
      },
      "palette": [
        "mesh"
      ],
      "placement": {
        "type": "poisson",
        "margin_m": 8.0,
        "min_distance_m": 9.0
      }
    },
    {
      "asset": "namaqualand_boulder_02",
      "count": 5,
      "scale_range": {
        "xy": [
          2.0,
          2.5
        ],
        "z": [
          2.0,
          2.5
        ]
      },
      "palette": [
        "mesh"
      ],
      "placement": {
        "type": "poisson",
        "margin_m": 8.0,
        "min_distance_m": 9.0
      }
    }
  ],
  "start_band": [
    2.0,
    6.0
  ],
  "target_band": [
    0.0,
    3.0
  ],
  "altitude_band": [
    1.0,
    3.0
  ],
  "instruction_obstacle": "standing stones",
  "exposure_bias_ev": -12.0
}
